{
  "schema": "agentlab.uiability_recovery_runtime_receipt.v1",
  "planSha256": "c9b1d35bbdd5029f76a0526ece1271f9b40acebfdf341d73af872c23c9752ec2",
  "source": {
    "repositoryId": "guide-snippets",
    "revision": "71bbb3916625c8d9a370b7a1989b3a7f82090525",
    "treeOid": "20bc24c3933662e0f7a55022bf918015407a94b2"
  },
  "referencePatch": {
    "sha256": "63256263bd260e9527a859b5121ddbb08e6db8a910f709dcdd0673c39a485de3",
    "byteLength": 7527
  },
  "environment": {
    "host": "huawei-ThinkCentre-M920t",
    "emulator": "codex_phone_7",
    "runtime": "HarmonyOS 7.0.0 API 26",
    "architecture": "x86_64",
    "buildTargetApi": 22
  },
  "artifacts": {
    "applicationHapSha256": "4e071215dd945a77c6908d41644d47bca87d0cebebd380777164bc8c8d60c12a",
    "testHapSha256": "9bae7fac8d8339869862acf3d424f0ae92bfff8e15e49697c8beac2041363aae"
  },
  "orchestration": {
    "owner": "host-supervisor",
    "trigger": "click-AgentLabRecoveryTrigger-appRecovery-saveAppState-restartApp",
    "operationId": "exec-0000000000000085",
    "routeDecision": "peer_direct",
    "targetPeerId": "lgw_60b9b37d14c4447f919196105a1a8b8a"
  },
  "evidence": {
    "beforeLayoutSha256": "81d27b619fbc7bdd6b043310000c6fce250e0287a51602435e1b0f0f2d9897dc",
    "afterLayoutSha256": "8ed0a81ac084bc9398912c49ffffbe23cc849d517b0cbf435665849281988e5d",
    "before": {
      "visibleText": "Recovered Twice",
      "launchReason": "NORMAL"
    },
    "after": {
      "visibleText": "Recovered Twice",
      "launchReason": "APP_RECOVERY"
    }
  },
  "result": {
    "referencePositiveControl": "passed",
    "wrongVariantsQualified": 0,
    "caseContractAllowed": false
  },
  "automaticPromotion": false
}
